fsq_id,name,address,locality,country,formatted_address,latitude,longitude,distance,link,categories,tips,kayak
578692f4498e1054905dbde7,Hotel 50 Bowery - JDV by Hyatt,50 Bowery,New York,US,"50 Bowery (btwn Bayard & Canal St), New York, NY 10013",40.715846,-73.996474,1102,/v3/places/578692f4498e1054905dbde7,['Hotel'],"All very hip and stylish, staff is super friendly and always helpful. Absolutely worth staying here!, Lovely view (my room was on the 19th floor facing north), good sized room, good service, clean. I love this place., Very nice gallery open to public on the 2nd floor with bricks obtained from excavation., Absolutely adorable, cool design and friendly staff. So convenient that they have a rooftop bar and downstairs lounge/club. Perfect place for my staycation-birthday., Very cozy and modern Chinese decor, a fantastic rooftop... Certainly, a good option downtown., LES premium for Chinatown locale. Cool roof top bar but you don’t have to stay there to check it out., Wonderful rooftop! Perfect for parties!, Amazing and really outstanding service and support! Never experienced such friendly people! Fantastic location, wonderful rooftop bar and restaurant, beautiful rooms and well-equipped gym!, New and fresh hotel, recommended, Check out the complimentary coffee lounge on level 2, it’s fabulous","Always an excellent experience at the Hotel 50 Bowery. Rooms have amazing views, and we were treated to a bottle of Prosecco as we were celebrating our anniversary. We appreciate the hotel’s management and attention to detail. | Great location, convenient to shop | Everything! Amazing location - walkable into Chinatown, Little Italy, Soho, LES.. SO clean, and hospitable. We arrived way earlier than expected and were able to check in early for a small fee. Very comfortable bed, friendly staff (particularly the rooftop bar staff!) | We loved the view from the room and the dining options close to the hotel. | A good hotel, very convenient location in Chinatown. Felt comfortable and safe walking around day and night, we especially liked the markets on Mott St. For the subway we used the Canal station, it was the cleanest in the area. The room was clean and the service was efficient. Another nice touch - the gym was great. | Great location , reasonable prices, clean and cozy room . Friendly staff. | Very nice room, very good service. | Comfortable 5 star hotel with white glove treatment in a perfect downtown location; a quiet pretty hotel, with courteous staff, easy parking, nice roof deck for breakfast / cocktails & fabulous gym, great amenities! | From our corner room (room 1230) we had a magnificent/awesome/superbe/wonderful view on both lower Manhattan and midtown Manhattan! Really stunning! | The room was spacious, clean, with large windows and offered a stunning view of the city. The staff is also friendly and competent. We used valet parking and the car was fine when we pick it up. So you can trust them with your vehicle, I think."
57ed4330498e34539123c310,SP+ Parking @ 1 Hotel Brooklyn Bridge,60 Furman St,Brooklyn,US,"60 Furman St, Brooklyn, NY 11201",40.702298,-73.995557,2292,/v3/places/57ed4330498e34539123c310,['Hotel'],"Great addition to Brooklyn with some amazing views of the city and best rooftop view of the Brooklyn Bridge., Amazing views from the roof of lower manhattan, Brooklyn bridge, and Statue of Liberty. Food on the roof was delish (lobster roll, guac, arrancini, fries), gorgeous addition to DUMBO with a strong eco-friendly vibe. the ""earthy"" smell throughout the building is slightly distracting but the beautiful rooms + amenities completely make up for it., Scenic view, quite near river, cool and trendy. Eco style with scenic view of the city, Insanely hip hotel but not in a silly way (mostly). Eco conscious rooms. Love the triple filtered water spigot right in the room! Comfy bed. Hotel space itself is gorgeous., Absolutely breathtaking from top to bottom. The designers paid attention to every detail and it shows. I almost wish I didn’t live in Brooklyn, so I could visit and stay here instead., The views are amazing. The place smells great. I love the decor. Honestly everything about it is great. Is this my favorite hotel ever?, Beautiful space with fantastic views of Brooklyn Bridge. The only thing I really hope they change is the clubby music in the lounge. It does not go with the chill eco lodge vibe!, Great place to stay if you want a walk into Manhattan via the Bridge. Views of the bridge within the hotel are outstanding., It's the first week, so they need to sort out some service kinks, but overall gorgeous hotel. Snag the bridge suite for an amazing 360 view with in-room hammock.","Amazing location next to the bridge and great service from the team. | Decorating and Location | It was such an incredible view and amazing hotel room! | Amazing location!! | The decor was beautiful , the staff were friendly and the view was amazing! | Fantastic hotel. Staff was extremely friendly and hospitable, great room with sunny view of Brooklyn bridge. Hotel lobby and amenities were exceptional. I look forward to making this a regular stay! | Room was lovely, comfortable, clean | Outstanding hotel with all the bells and whistles. Progressive values, incredible design, amazing customer service and the best location with the most incredible views and sunsets. Loved our stay and would highly recommend to anyone and everyone! | Location . | Great location, beautiful hotel. The rooftop bar and pool have amazing views"
5648ead638fa50411e04d842,Walker Hotel Tribeca,77 Walker St,New York,US,"77 Walker St (Walker Street), New York, NY 10013",40.718246,-74.002077,566,/v3/places/5648ead638fa50411e04d842,['Hotel'],Thoroughly enjoyable. An excellent coffee shop and a speakeasy on site. The rooms are modern and tiny. Each crammed with a king bed. It’s laughable until you find that you’re loving it.,"Awesome spot. Very cool location. | Everything perfect, but the view was the best from the bed near the window | Amazing location | The hotel was a great location. The coffee shop on the first floor was great. The staff were very attentive and kind. | good location | Location and staff were great!! | Restaurant is good although a bit pricey | Had a great view | dope hotel. | Love the beautiful design of the hotel. I had some issues with the room which was addressed professionally by the staff member. The breakfast at the cafe was amazing."
515a1b3ee4b0f84f522c4b7f,The High Line Hotel,180 10th Ave,New York,US,"180 10th Ave (at W 20th St), New York, NY 10011",40.746002,-74.005009,2863,/v3/places/515a1b3ee4b0f84f522c4b7f,['Hotel'],"This is easily my favorite boutique hotel in the city. The staff is extremely friendly and helpful. About 6 months after I returned for my second stay, they still remembered my face and room. <3 them!, Recently opened as a converted seminary. Wonderful courtyard, comfy beds and Intelligentsia coffee in the lobby make this a winner. Not indulgent, just a great place to stay., Excellent boutique hotel with an Intelligentsia coffee cart and quick access to the Highline park. Rooms are spacious; beds are ridiculously comfy. Eclectic decor; nice toiletries from CO Bigelow, A hidden gem in Chelsea! The High Line Hotel, is sophisticated, non-pretentious hotel with historic charm to it. Perfect for date night or grabbing drinks and having a chill night in the city, Beautiful!  Also obviously right next to the High Line.  Wish I would have stayed here!, grab drinks in the courtyard during the summer. perfect couches inside to cozy up and read with an intelligentsia coffee., Great event space adjacent to hotel. Cherry bombe 2nd annual jubilee was amazing! Catering by sweetgreen, whole foods and stumptown coffee, What an amazing hotel! Beautiful grounds, awesome service, cozy but great lobby bar. Check out the backyard garden and see if you can get a tour of the ballroom!, Amazingly cosy and quaint hotel. No room service but don't let that stop you. One of my favorites in NYC., Great location, cozy and spacious room with interesting vintage furniture/accessories, and they have intelligentsia coffee. What more could I want!","Great WiFi | Location to Chelsea piers | quaint, cozy, character | Location is excellent, and the facilities themselves are first class. The courtyard out the front is beautifully set, and a very pleasant place to sit and read while having a drink or catch up with friends. The bed was extremely comfortable and bathroom well equipped. | Lovely boutique hotel with tons of charm. The room and entire facility was full of character. And....Best shower ever! Outdoor bar has a lovely selection of cocktails and small bites. Very pleasant way to spend an afternoon. | I choose this hotel as it is next door to where my meetings are and that eliminates extra travel in the city. | The bikes were great. | Beautiful building and rooms. Great location. | The bed was great and super comfortable. Great welcome upon check in. The location is hard to beat. | Coffee shop closed for the duration of our stay, no air con."
62b4f2508643a3291d42e00a,Hotel Chelsea Lobby Bar,226 W 23rd St,New York,US,"226 W 23rd St, New York, NY 10011",40.744337,-73.996777,2846,/v3/places/62b4f2508643a3291d42e00a,['Hotel Bar'],"Gorgeous renovation! Killer bar., Great snacks and wonderful mocktails","The renovation is beautiful and cozy. The bar/restaurant/lobby stays really lively and it is obviously a very happening place in NYC. A very fun place to stay! | Everything …hotel super cool | From the room, to the art, to the food, to the location, to the vibe. The only place to stay in NY. | A unique and unconventional hotel. We really loved its location, atmosphere, and service. Everything was excellent! | Outstanding service . Elegant sexy room | Beautiful lobby and old world feel. Lovely bar and restaurant (super pricey bar) | Beds and pillows need to be updated. Very uncomfortable | Amazing | The Chelsea Hotel is an exquisite property. The history of this hotel alone makes it worth staying, and the hotel rooms and common areas are over the top luxe (especially the gorgeous bathrooms)! The vibe of old world charm is felt throughout the property, and every staff member I encountered was friendly and efficient. I will definitely return! | Charming, cool, atmospheric. The restaurant is wonderful."
4a6e3e75f964a5204ed41fe3,"Gild Hall, A Thompson Hotel - part of Hyatt",15 Gold St,New York,US,"15 Gold St (at Platt St), New York, NY 10038",40.707863,-74.007078,1382,/v3/places/4a6e3e75f964a5204ed41fe3,['Hotel'],"Freindly helpful front desk, free glass of Prosecco upon arrival, very clean and immaculate throughout, big room with massive comfy bed., The rooms are actually fairly spacious for NYC. A really nice sort of “lodge” vibe. The lobby also smells great and the restaurant has a great breakfast., A beautiful boutique hotel nestled in the Financial District.  Relax in the lobby and watch the world go by., Friendly helpful staff, cosy old style feel, big room, massive very comfortable bed, cleanliness throughout, best described as a hip library feel. note: the bathroom door is clear., Guestroom amenities and services - All rooms will feature Custom made 400 thread count SFERRA linens, down bedding, flat screen TV,  iPod docking station and alarm clock, cordless handheld phone, Dean, Award-winning writer Milda De Voe holds a free literary salon for fellow writers/parents on the 2nd Tuesday of each month. Sept-May, 7pm., Award-winning writer Milda De Voe holds a free literary salon for fellow writers/parents - the 2nd Tuesday of each month, Sept-May at 7pm!, From the from of the house to the back - everyone is exceptional. My tip - just have a conversation and enjoy!, Rooms were nice but small, hotel staff was friendly. My recent stay was a bit loud from all the construction in the area...","Nice hotel. Nice location. Lovely staff. | The hotel was freezing cold!!! We couldn't enjoy our breakfast and we even had jackets on!!! It was very uncomfortable everyday even froze while trying to have overpriced cocktails! Breakfast was served warm but never hot! | Good location, close to metro station | Location, staff and ambiance | Large room with good facilities. | Location. Functional room. Nice staff. Quick check in. Comfortable room and bedding and bed very clean and new. Complementary water but first night only | The room and location was very good. The receptionist very friendly and helpful. | The room was nice, the staff was top-notch, and in a sneaky good location of the city. | Ideal location for family stay. Comfortable and well proportioned rooms. Helpful, friendly staff. | The hotel is the perfect location for Seaport attractions and financial district. and close to subway. The room we choose was a King Deluxe and we were pleasantly surprised by the size of the room and loved the style as well. Furnishings are beautiful. The bed was comfy but pillows could have offered at least one firm option (luckily I brought one of my own). Breakfast was served at Hotel restaura..."
4b5668d6f964a520370f28e3,SIXTY LES Hotel,190 Allen St,New York,US,"190 Allen St (btwn Stanton & E Houston St), New York, NY 10002",40.722119,-73.988567,1695,/v3/places/4b5668d6f964a520370f28e3,['Hotel'],"Make sure you you check out the pool during rhe summer and of course the beer garden on the 2nd floor.... great staff and service is impeccable...love this hotel ... just my style - not for everybody, Follow them on Facebook and then attend one of their many weekly pool parties during the summer to enjoy their fabulous Andy Warhol pool., Front desk people are awesome. Call when PostMates show up, left me extra blankets (NYC is chilly!) gave me a map of NYC. Only bad thing so is that wifi is a little spotty., Comfy beds. Good food & drinks. Great downtown location. Hip, but not inaccessible. Sam at the front desk is the bomb. Will definitely return., New York's only hotel with an Andy Warhol print on the bottom of its pool. Things have quieted down since the days when the neighbors were complaining about the pool area being used as a nightclub., Beautifully done! Wonderful size rooms with a great decor. You can tell a lot of thought went into this. Wish the walls were thicker. You can hear EVERYTHING  in the rooms next to you!, 2016 update: formerly the Thompson Hotel (see: all tips before 2015). The location is great, hotel is trendy but hit its peak around 2008, walls are thin. Overall, nice place, but don't pay full price, Fantastic place. We love the rooftop pool with psychedelic Warhol art at bottom and the insane exploding-sun chandeliers in adjacent SHANG Restaurant., My current go to hotel in NYC.  Perfect location and nice, clean rooms.  You can get a good rate if you plan ahead., The new rooftop bar ""tiki Tabu"" is quite original. It's clean and small and has a decent view. Be warned, tip is included on the tab.","Disappointing… not as nice as pictures suggest. Staff not really interested in you. | Breakfast was not included. The room was very comfortable and spacious with a lovely bathroom | Big rooms, great location, various places to work both in the room and the hotel itself. Lends itself well to business travel (and leisure) and it’s one of my top choices in LES. | There was some food smell when you open your room window coming from the outside and also inside the ventilators Big problem I had | I liked the location! There was no door man to help with the bags so that made my stay uncomfortable | Location | Where it's located is perfect. Now some the pool is tiny and the rooms are even smaller. It has a luxury feel but it's not comfortable to a holiday Inn or Marriott. Everything is an up charge and pool drinks are a rip off. In a pitch a decent spot to sleep and feel good in the city, but if your paying full price looking for exceptional you will be very disappointed. | Great location and very accommodating and helpful staff. | The location was great. Interesting neighbourhood with lots of independent shops, restaurants and bars and easy to get the subway into the centre. Hotel staff were courteous. The hotel looked after our luggage after check out on the final day. | Great location, cool hotel, the room was more than adequate. Complimentary coffee and tea every morning in the lobby downstairs was greatly appreciated. And the view of the skyline was gorgeous."
4b93baf1f964a520de4e34e3,DoubleTree by Hilton Hotel & Suites Jersey City,455 Washington Blvd,Jersey City,US,"455 Washington Blvd (at 4th St), Jersey City, NJ 07310",40.723609,-74.036734,2387,/v3/places/4b93baf1f964a520de4e34e3,['Hotel'],"The staffs are super friendly and helpful. As a Hilton Gold member I was offered a complimentary room upgrade to a suite with river view., Instead of staying in expensive and busy districts in Manhattan, this DoubleTree hotel serves as a great option if you don't bother traveling across the Hudson River every morning through PATH trains., Amazing experience- Start to end. Amazing cookies, super friendly staff, super neat and clean, and good shower water pressure/high flow rate. What more could one want?, Hungry for dinner after you've checked in? Order from VB3 next door! It's 1000 times better than the onsite bar. Stop reading this & go grab a menu from the front desk. You won't be disappointed. :), Felix really helped us out especially during this rough time of hurricane sandy hotel hoping. Definitely will return because of him (and the cookies)!, Our family had complicated logistics. The staff was truly amazing. And there were amazing cookies!, That's Shay, when she's not there See Margaret.  The dark glasses guy is good too., Felix is cool as is the entire staff. Cookies, you can't gi wrong. Super close to Harsimus Cove light rail stop, Newport Mall..., Felix is such a character!  I would return just for him! Everyone was so nice. Short cab to Hoboken, Free WiFi in the lobby or in your room if you're a Hilton Honors member.","Location | Hot cookies upon arrival were so delicious | The staff is very friendly and helpful. | The rooms were spacious, had a great view, and clean | For a small extra fee per night we had a 12th floor room with a superb view over NYC! We 2 PATH stations in a 5 minute walk it is easy to get into the City. Nice to have free coffee in the morning at the restaurant. On site parking with unlimited in/out. | The room was big and confortable. The hotel was very close to grocery stores and most importantly to the Path station!!! A big mall is just a few minutes away on foot with many options of shopping and restaurants. | The stuff was great (especlially the woman on the dining room), the location was good and close to a path train station, breakfast was great! | room was very good & clean | Good location, big room, very comfortable, amazing view of NYC and very nice staff in the from desk, restaurant and cleaning. | Close to certain events"
4bed7bbebac3c9b60157fee9,The Frederick Hotel,95 W Broadway,New York,US,"95 W Broadway, New York, NY 10007",40.71558,-74.008868,539,/v3/places/4bed7bbebac3c9b60157fee9,['Hotel'],"Staff are AMAZING, rooms are a good size for NYC. Generally a great hotel in a great location.","The bed was so comfy, and the TV had amazing options to unwind after a long day. The shower was so hot and clean. The location was amazing and the staff were even more amazing. And the breakfast had so much options, well worth the money. | Cleanliness, comfort, good location and kindly staff. Also, breakfast was really good. | Staff was so friendly, warm & welcoming. Room was very clean, bathroom super clean! We didn't use it, but the mini bar was well stocked. Nice towels too. | Location is amazing! Staff were kind, helpful and very reachable. | The location is unbelievable, for walking or using the train with the 1, 2 & 3 trains just in front of the hotel its unmatched. The staff were super professional at all times and very respectful. | Everything - staff, location, room, security, breakfast, bar, etc. | Location | Location, vibe, staff | Clean, helpful staff | Excellent location Comfortable room Goo breakfast"
5bab15af3b8307002cc005ef,IHG Hotels,3603 Prince St,Flushing,US,"3603 Prince St, Flushing, NY 11354",40.762316,-73.83292,15510,/v3/places/5bab15af3b8307002cc005ef,['Hotel'],,"The room was a good size for Manhattan, very quiet location even with the window open. There were a couple of issues with the electrics in the room - my bedside lights and the TV didn't work - staff came to fix these late in the evening. The variety of dishes at breakfast was very good and al the staff most helpful. | Nothing | Loved our room which was clean and comfortable. | Location and staff were superb. Room was comfortable and a good size with lots of amenities | It was a very good experience , I loved the services , the rooms were clean ,bed was comfy . Very busy hotel but it’s a good kind of busy . | It took 3 tries to get our room, however we finally got in and it was completely fine | Lovely NY hotel with an upscale yet relaxed atmosphere, beautifully appointed. | The beds are very comfortable | The location was convenient. The staff was very helpful & friendly. The hotel is very elegantly decorated. | Nice breakfast buffet with many options. The location was great as it’s right in the middle of Manhattan, so close proximity to everything."
57c98c00498ede2ae6ad9755,Arlo SoHo,231 Hudson St,New York,US,"231 Hudson St, New York, NY 10013",40.72445,-74.007998,471,/v3/places/57c98c00498ede2ae6ad9755,['Hotel'],"Trendy, Soho, good location, small rooms, cozy atmosphere, busy, stylish. Amazing rooftop, library bar, restaurant on the first floor, happy hours. Super welcome staff, city views, Great hotel! Great staff and always something going on from Pilates on the roof to meditation. Wish I used the gym across the road! Looked great. Nice view from room too would def come back, Looking for something fun to do while enjoying a drink? Every wednesday, Arlo and NYC Trivia League present a fun low key trivia for guests and patrons to enjoy.  Starts at 7pm, You know you're arriving at the Arlo because there's a heavily perfumed scent wafting through the air outside. Once you acclimatise, it's a good hotel with particularly good facilities (bars/food)., There’s a quiet library and patio on the second floor.  With free wi-fi, it’s a great place to get some work done or have a quiet meeting., Great rooftop bar cozy lobby library quaint courtyard friendly staff complimentary bikes with lock and helmet located right in trendy west village area convenient to shopping and great dining options, Very cool new hotel on Hudson street just north of canal. Their rooftop bar is phenomenal although weather dependent., We celebrated a friends birthday at the Arlo Arctica and it fell short of expectations. The drink menu wasn’t festive with hot cocktails as it had been in past years and service was deplorable., The vibes, open concept lounge, and the cool, contemporary Scandinavian-chic interior design, Nice people. Modern design. Tiny tiny rooms. Comfortable for a solo traveler, challenging with two people.","The bed is a bit small. That’s it. Rest of the facilities are great. Nice people | Very noisy hotel. The rooms overlook venue with noisy parties that end at 23:00 | The price was deceptive. It said taxes were not included, which is ridiculous as the taxes made the room very expensive | Staff were nice and hotel was clean | Very good location, pleasant staff | friendly staff, modern decor, good dining options | Location, staff, cleanliness, quietness, daily water, | The great location in soho near the good shops , restaurantes .... , the breakfast and room are very good , the staff are very nice and the hotel new and clean , superb rooftop . | The staff were nice and friendly. The front desk staff and the once at the entrance were very nice and helpful. | Great staff, fab location, rooms are small but perfectly formed. Cocktail lounge was lovely and the communication with guests throughout the Stay was excellent. Rooms were cleaned daily to a very high standard, and the bed was very comfortable. I would reccomed this hotel."
