fsq_id,name,address,locality,country,formatted_address,latitude,longitude,distance,link,categories,tips,kayak
49d3d4a7f964a5201a5c1fe3,"The Standard, High Line",848 Washington St,New York,US,"848 Washington St (at W 13th St), New York, NY 10014",40.740848,-74.008037,2287,/v3/places/49d3d4a7f964a5201a5c1fe3,['Hotel'],"Gorgeous hotel.Stylish and modern.From all Manhattan's neighborhoods I like Chelsea the most.Closeness to Chelsea market and High Line is a big advantage.Take room with river view and rooftop is must, Among The Standard's greatest draws are its views. Of models, yes, but also of the Hudson River & downtown. Ensure you get a room ending in 24, which will net you 2 walls of windows., My favorite hotel in my favorite area in Manhattan. Both the staff and the decor are hip, stylish. Bonus of easier access to the exclusive clubs Bain and Top of the Standard. Walk on the High Line., The Lower West Side design hotel offers more than sexy rooms with floor-to-ceiling windows. Note its rooftop bar & disco, Le Bain, as well as its popular, Bavarian-style beer garden., My favorite hotel in NYC. Amazing F&B outlets and every room has a view. Make sure to get into Top of The Standard before 9pm when they transition to a ""members club"". So dress to impress!!, Floor to ceiling windows in each room make for the most incredible views for guests in the hotel. You won't run out of things to do here, from the Le Bain, to the Standard Grill and the Biergarten., the biergarten, grill, boom boom room, and rooftop are all new york staples. download the one night standard app for last minute same day hotel room deals. amazing design overall and great location, Upstairs you have the Boom Boom Room, whose views of the city is unparalleled, and Le Bain, perhaps the only place where you can gaze over Manhattan in a hot tub with a vodka tonic in your hand., love it love it love it! this is the second time we stayed at the standard high line and will come back - funky, well located in meatpacking and wonderful service, You’ll drool over the modern rooms (dig the soaking tubs) and the outdoor biergarten for the simple fact that it offers sausages, pretzels, world-class Bavarian brews and ping pong.","Location | Everything… the view on Empire | The vibe, the view. The retro decor in combination with the original light bulbs that give the luxurious soft light, the real fresh air from the windows that can actually open a bit. My favourite place in New York. | Room was great and had the most amazing view! The staff were so kind and helpful, and upgraded us free of charge. The location is very cool, close to some amazing bars and restaurants, and away from the direct craziness/touristy parts like Times Square etc. | Great location, staff are pleasant, good restaurants | Great location | Location was great | La vue, la chambre. | Incredible. Love the vibe. Always have always will. The view is stunning. | I had a fantastic view on the Hudson and the Whitney. Very comfortable bed."
587f8878c45ee34e4c6c2f8a,Public,215 Chrystie St,New York,US,"215 Chrystie St (btwn E Houston & Stanton St), New York, NY 10002",40.722996,-73.992007,1428,/v3/places/587f8878c45ee34e4c6c2f8a,['Hotel'],"Very cool new hotel. Especially love the garden at the entrance. Unfortunately no service there but s great zen space., This sceny LES hotel known for its instagrammable elevators with two lovely restaurants on the first and second floors operated by Jean-Georges., Good views at the rooftop bar but no shade - on a hot day it's a bit like drinking on a very chic sidewalk, just a bit closer to the sun., Check in was an absolute disaster. Yes, it's trendy to have models & iPads & no reception but when it takes 90 minutes to check in one person, y'all got issues & a comped drink ain't cutting it., Pro tip: late at night, you can get free milk and warm cookies from Louis. Just ask and show your room key. 🤫, Beautiful new hotel in Nolita, great rooftop views and cool common areas., The quintessential New York hotel. Cool designed rooms with huge windows. Good service, one of the most beautiful rooftop bars in town., An all-around awesome hotel - design is spot on! The gift shop is really cool and the rooftop bar is one of NYC's best!, One of the best rooftops in NYC. Design hotel., Best spot for unobstructed views of the city. Go to the roof on weekdays for a more relaxed vibe. The best views are facing north.","Amazing hotel, friendly staff and awesome location right next to a Wholefoods and with 2 CVS-es located within 5 mins walking. Katz deli is also 5 mins away and Soho is ~8-10 mins away. Citibike docking in the park opposite and subway station right next to the hotel. | PAY 2 TIME THE TAX | Apart from booking amount they take 40 to 45$ extra per day towards the facility charge which was surprising. It’s kind of hidden charge. | We had a great experience but one thing that was a little weird was the bathroom. It was glass walls and even when the lights were on it was still see through. I couldn’t imagine staying here with a family member lol but other than that it was a good stay! | It’s a master piece | Charging for resort fee without mentioning in advance. Not friendly reception staff, Broken automate sheers. | Facilities are impressive, but the lack of staff is somewhat jarring. There is a hidden building ""access"" fee that allows you to use the lounges, bar etc. There is a free morning fitness session, but the instructors never showed up. Any requests need to be made over text message which isn't immediately apparent. Walls are also very thin as are windows - even though I was on the 15th floor I could ... | They have a a fee for accessing their rooftop and other facilities. However, this seems a little excessive for a one night stay | Cute cosy room with great service. Excellent on site restaurants. Great bars with lively contemporary music. Awesome roof top. Complete overall package. Would definitely stay again. | I didn't know there was a mandatory access fee that you have to pay even if you don't use any of the services listed until I got to check in. There was tissue left inside the toilet when I got into the room. The room had VERY BAD soundproofing I was forced to listen to the beats and music down at the bar as well as drunk people chatting in the hallway at 2 am in the morning. The only great thing i..."
4f22ca77e4b0ed3396a83a05,Conrad New York Downtown,102 N End Ave,New York,US,"102 N End Ave, New York, NY 10282",40.715014,-74.015786,845,/v3/places/4f22ca77e4b0ed3396a83a05,['Hotel'],"Beautiful Design Hotel right in Battery Park across from the World Trade Center. Much more spacious than hotels located in the middle of Manhattan. Highly Recommended., Beautiful hotel with a great location relative to the Financial District. The rooms have a strange layout, though; the shower and toilet are separate and offer less privacy than a typical hotel setup., The bar is now well known for their ice pops made from pureed fruit and then flavored with various spirits: the “Prosecco & Ice Pops” is mixology fusion at its best., I stayed here 7 times in 2013... this by far is my favorite hotel in NYC. HUGE Rooms....Giant walk in rain showers....its like home away from home but nicer!, Great Hotel in the middle of Battery Park City. Everything is taken care of. Food in restaurant is very good., Simply love this hotel. Try to get a room with a view on the Hudson., It is a good hotel to people with business purposes. In my case, tourism and shopping, it was a little far from the Broadway. But, good hotel anyway., Access quintessential 1, 3, and 5-hour NYC experiences curated by Conrad to discover the local take on culture, art, food, and adventure. Ask the concierge, or click Read more. #StayInspired, A hotel one would definitely consider to stay in, its a great one with a great view, great service and awesome surroundings and the best thing its near to World Trade Center :), Be sure to check out the newly renovated Loopy Doopy Bar on the 16th floor for some rooftop drinks. The Watermelon 10 Cane Rum Mojito Popsicle is perfect on a warm summer evening.","Like everything about the Conrad Downtown. My wife and I think to try something new and ""special,"" but we are always drawn to the hotel. Five visits in five years. The hotel is walkable to so much. The Oculus is a block away. Ferry dock across the street. The on-site restaurant is extraordinary. There are many handfuls of restaurants within four blocks of the hotel. If you are interested in shoppi... | I love staying at the Conrad downtown but my last visit was disappointing | The hotel overcharged me by hundreds of dollars and will not return any of my phone calls or emails. | Excellent room size especially for NYC. Polite, courteous staff. Bar and restaurant area was good, if on the expensive side. | Everything was perfect. The room, the food, the staff. They really go far and beyond your expectations. | Location is very good and convenient. I love the surroundings. | I tried to change the date of the reservation through Booking.com app and didn't work because it was bugged. I called Booking.com and was told to call the hotel. I called the hotel and they were rude and said that only Booking.com could do it. I called again Booking.com and was told that only the hotel could. I end up paying almost $1,000 penalty and couldn't change my reservation. Was a loyal use... | Spacious room | large corner suite was spacious and comfortable | Front office there was an lady she is so respectful and helpful"
554c1b85498efa107620d07e,The New York EDITION,5 Madison Ave,New York,US,"5 Madison Ave, New York, NY 10010",40.741354,-73.987401,2938,/v3/places/554c1b85498efa107620d07e,['Hotel'],"This place has some seriously sexy vibes. Have a seat in the lobby bar, check out the gorgeous scene and people. Will quickly become my neighborhood haunt!, My favorite hotel all over the world. They train their staff so incredibly well, so kind and helpful above and beyond. Service points x 1000000 and great bar and restaurant to boot, Service is amazing ! Rooms are beautiful ! Views are addictives., London chef Jason Atherton draws the NYC foodie crowd with mac n’ cheese spiked with slow-cooked ox cheek and morels, as well as other reinvented tavern food., if you're in the area, good spot to get out of the cold and stop for a drink/meeting. i also can't seem to get enough of the Le Labo Noir 29 fragrance hanging in the air., Wow. What a hotel. The rooms as incredibly nice and modern. The bed is super comfy. The lobby bar is busy on Saturdays. The reception employees could be more courteous, Inspired by private clubs of the 20th century, the new New York hotel is carved out of turn-of-century clock tower bordering Madison Square Park., My favorite hotel in NYC. Beautiful rooms, friendly staff and a great location. Every stay here has been perfect., Great dining room, chic lobby, good service! Great new addition to the hood!, Amazing cocktails!!! Gin lovers, please try give pea a chance and dill or no dill !","Location and service amazing | Location only. Nothing else. | Elevators are terrible. Service is terrible. No lounge access as it is always booked abd packed. No one to help you in or out with your bags. Self service all the way. It also took 2 HOURS to check in even though i arrived at 4pm. Hotel is old and furniture is way over-used. Never again. | Beautiful but would expect coffee machine in a suite in any hotel but especially the edition. Beautiful non the less | Check in time is 4pm I have never experienced all over the world. Unkind staff. dirty room. Terrible. 빚좋은 개살구. | Location | Location | old and smelly | Great location, valet parking which is so important in NYC, the staff was always pleasant, the design is modern and clean yet warm and relaxing. | Customer service, facilities"
558dff09498e0910b7cbf9bd,"EVEN Hotel New York - Times Square South, an IHG Hotel",321 W 35th St,New York,US,"321 W 35th St, New York, NY 10001",40.75348,-73.993905,3889,/v3/places/558dff09498e0910b7cbf9bd,['Vacation Rental'],"Awesome location, great concept of a healthy and fit hotel. Very nice service (as expected at an IHG brand hotel), located midtown Manhattan near Time square. My place to stay for further NYC Trips, One of the best experiences! The personal is amazing, the gym, rooms, everything!, You can change the colors on lights behind bed! Blow dryers included! Got ping pong table at ground floor! Very close to 35/penn station, 2 min walk!, Small rooms but clean and nice. There’s a mini fridge and keurig in the room. And lots of fun workout / yoga stuff (also clean), make sure to swing by the check in desk @9pm for nighttime tea- yum!, To La Guardia airport - take E (Express) train & exit Jackson Heights, walk to street level & take Q70 bus to airport. Use metro card to get receipt for bus ride., Help yourself to a refreshing glass of lemon/mint/ginger ice water in reception!, Everything is awesome., Perfect location, Hotel muito aconchegante sem barulhos e com academia no quarto topp!","Overall, nice hotel, nice and convenient location. A bit noisy since we got a room on the 3rd floor but its NY so its expected. | staff were accomodating and helpful. | The staff were polite and courteous, making the experience even more enjoyable. The rooms were new and very clean, providing a comfortable and pleasant stay. | The hotel is modern and clean with big rooms and good WiFi. The location is near by the subway, so it’s very nice to get to any part of the city. | The friendly staff and convenient location to MSG. | Staff | Nice, clean hotel in a great location! | The best thing about the property was the staff. | very clean friendly staff room not cramp very comfortable near a subway entrance everything is walkable | The location was excellent One of the front desk staffs , i think his name is Christopher gave me a 5 star service! He went the extra mile to ensure that my stay was comfortable,"
55ef1bf1498e544c84ae6419,Hampton Inn Manhattan/Times Square Central,220 W 41st St,New York,US,"220 W 41st St (7th And 8th Avenue), New York, NY 10036",40.755617,-73.988703,4284,/v3/places/55ef1bf1498e544c84ae6419,['Hotel'],"newer hotel, very nice and very consistent. Definitely meets my expectations for the Hampton Inn brand, Brand new hotel but the rooms are so small. Didn't expect that from a new hotel but I expect that from nyc., Pretty good. It has all you need, The Room was nice and the location is very convenient. Friendly personal. Recommended., great hotel close to times square and broadway shows!!, It was good , few elevators which caused problems and delay . Very small room, Good price, perfect location, good breakfast buffet included., Clean and modern in an excellent location, Clean at the center of everything., Great location,  great lighting","Location and staff | location & price | the breakfast had excellent selections, very friendly staff and very clean rooms. Would stay here again forsure! | The hotel staff and location was excellent. We were able to walk to most all the main attractions. When we needed transportation, the hotel staff was more than willing to help us out by booking the ride for us. | Very friendly front desk staff. I felt like I was being treated very well! Room was clean. | The staff where amazing helpful and patient on the evening we landed my card wouldn’t work and they showed great patience. I would like to have known that they didn’t accept cash before my stay but it wasn’t a problem the staff are a credit and so knowledgeable in guiding you. Shout out to that one staff members name I can’t remember but he loves mrs browns boys you where amazing ❤️ | fantastic location, room good size | I recently stayed at this hotel and had an exceptional experience. The location is unbeatable, just a short walk to Times Square, making it perfect for exploring the city. The staff were incredibly friendly and welcoming, always going out of their way to ensure a comfortable stay. The hotel itself was spotless, with well-maintained rooms and common areas. It was evident that cleanliness is a top p... | Location | great location."
4bec60a5f909ef3b2808a9c6,Kimpton Hotels,851 Avenue of the Americas,New York,US,"851 Avenue of the Americas (btwn W 29th & W 30th St), New York, NY 10001",40.747109,-73.990072,3379,/v3/places/4bec60a5f909ef3b2808a9c6,['Hostel'],"I love this hotel! I stay for work and it converted me to a Kimpton fan. Rooms are huge by NY standards, very modern, quiet and trendy. The staff is what makes this place different. They are awesome!, Top location for shopping. The hotel itself is nothing short of a 4 star. Very modern interior and the standard rooms are spacious. Breakfast is not a must as it is nothing mind blowing., We were given their deluxe room worth a great city view including the Empire state building. The service we received was excellent: everyone went out of their way to make sure we were taken care of., the fifth floor rooftop garden - don't miss. no visit is complete without that view and a glass of wine to go along with it. bring friends - seats are plentiful., Beautiful and amazing hotel. Very caring and helpful at check in. Valet parking was a little frustrating as it was amidst a shift change at check in. Had to self park. Will stay again., Even under construction, the Eventi is a lovely hotel with marble baths, a great view of the Empire State Building,and lovely service., Centrally located, close to many touristic attractions and metro. Rooms are descent, clean, very good enough for short stays. Gym, restsurant, bar, meeting center available. Prices are affordable., Modern chic design with attention to comfort. Awesome night views of the Empire State Building from some rooms. Best front desk staff in town, particularly Sarah, Marco, Kevin, Dipali, and Rebecca., Love Kimpton hotels! Great room & bathroom design. Friendliest & most attentive staff in NYC. Dipali (Concierge) is wonderful. Yoga mats in every room. Ask for a view of Empire St Building., We love this hotel for it's great Midtown location with views of the Empire State Building, free wine happy hour from 5-6pm, and reasonably priced hotel rooms.","I liked the location, the view, the lobby had nice energy, the room was clean and spacious. | The staff was very friendly and it was very clean and quiet. They arranged transportation to and from the airport which was so convenient and stress free. | Front desk service | Beautiful property | We have stayed here before. Centrally located to a lot of attractions.Three restaurants and the pizza in L‘Amico is the best ever! Happy hour every evening and they served really good wines. | Good restaurants and gym | Rooms | would definitely recommend this hotel. great location & room is clean. | One of the staff members was unfriendly and unhelpful when providing information. Additionally, the $2.50 baggage fee for bag storage felt unnecessarily fussy and diminished the overall experience. | Great hotel lobby with awesome restaurants and vibe. The location was perfect. Close to shops, K-Town and Highline. Staff were great. I paid extra for early check in and we were in our room by 10am which was perfect coming from a red-eye."
59aaa4888a6f173536519ecb,MADE Hotel,44 W 29th St,New York,US,"44 W 29th St, New York, NY 10001",40.746311,-73.989648,3295,/v3/places/59aaa4888a6f173536519ecb,"['Hotel', 'Lodge']","I know a well designed hotel when I see one. This one takes the prize. Wood in and elegant way, 70s touch and warm winter style, Modern Concept hotel, very comfortable bar and restaurant, Find a flight of stairs on the ground level leading to a small garden. The garden would have been an oasis if not for all the exhaust fans blowing down on it from surrounding buildings, Excellent new hotel - great view of Empire State building, Do NOT stay on floor 17 if you want to sleep. The rooftop bar is directly above and you can hear everything - music, doors, water running, clanking - until they close way past midnight., Just opened. Nice vibe. But still a work in progress., Never take closets and rubbish bins for granted. Be careful when taking showers as the bathroom looks good but it’s not that functional., very cool vibe, 10/10 would recommend staying here, Тихий, приятный отель. Хорошие завтраки","This place is gorgeous and the lounge/coffee shop are a perfect place to hang. | Location, friendly staff | Comfortable, clean room. Loved the shower and toiletries. Friendly staff. Great happy hour. | Brilliant hotel in New York. The staff were so kind and helpful with all our requests and went above and beyond to accommodate us. The room was spotless and in a central location. Quiet at night and all round great stay. | Good shower, | The room was really well designed and the bed super comfortable. | Our stay at MADE Hotel in New York for my daughter’s birthday was truly unforgettable. From the moment we arrived, the hotel exceeded our expectations. The room was beautiful, featuring a private terrace, and it was kept impeccably clean throughout our stay. One of the standout gestures was the incredibly generous late checkout—at 10 PM—which made our final day in the city so much more relaxing. A... | Great location, easy access to subway station on 28th St. Free coffee 24/7 a godsend. Wine hour 5-6 pm | MADE is 1 block from the subway for Uptown and Downtown therefore the location was great. It was quiet unlike uptown Times Square. It’s got a very good vibe to it. | The location is good"
56d61e11498e4c3c305da704,Riu Plaza New York Times Square,305 W 46th St,New York,US,"305 W 46th St, New York, NY 10036",40.760161,-73.98827,4759,/v3/places/56d61e11498e4c3c305da704,['Hotel'],"A chic and beautiful hotel located in the heart of Manhattan, within walking distance to many great sites. Riu is a trusted worldwide brand and I recommend this hotel to anyone coming to NYC., fantastic hotel with a great location rooms have views of the city thatbwill captivate your eyes, Lobby and rooms are beautiful and modern. Everything is new and bathrooms are super chic. Close to Times Square/Bryant park. Great weekend getaway., Stayed here for a getaway within city weekend and it was awesome!  Comfortable bed, beautiful plumbing fixtures, bold artistic lobby and industrial chic hallways. Great view from the higher floors, Nice place , location is excellent , the bad thing is that rooms are really noisy , the employees are working till late hours closing and opening doors , not good rest ., Great location. Great staff. Good rooms., Nice breakfast but eat iT in the bar. Nice and quite. Lounge is a perfect idea!, No AC system in winter! But great location. Good for a weekend stay. Good breakfast, and a nice bar.., Central location,  friendly staff. New hotel,  beautiful rooms and lobby., Living 5 nights,breakfast is awesome","Location. Proximity ro our theater and the many restaurant choices made it ideal. | It was great location, clean, staff very nice, beds super comfy | The cafe was fab also the Fashion bar | The hotel was clean, service was very good, view from the room was nice, breakfast was very very good | very good breakfast menu, high diversity, very well organized, very clean premises , good place and ambiance . | Wow! What a beautiful hotel. The moment we walked in, we were amazed at the beautiful modern decor and lovely Christmas decorations. The staff were very friendly and helpful. Our room was on the 23rd floor and had great views of New York. The breakfast had a huge variety and was incredibly tasty and I loved the gym, and although I was super busy doing hundreds of tourist attractions I still manage... | Breakfast great (but very crowded, however they do a good job managing this), great location. | Needed restaurant | The people | Wonderfull place strongly recommended"
